{
  "receipt_schema_version": "myresearcher.encoder-m2-s1-owner-authorization-receipt.v2",
  "authorization_granted": false,
  "owner_decision_id": "NO_OWNER_DECISION_RECORDED",
  "expires_at_utc": "2000-01-01T00:00:00Z",
  "frozen_contract_commit": "df12078b90f21c5942f838fb2175b636bc20a5db",
  "contract_sha256": "80e792fb796e66777a0b7607982aa17823cef8890577fdef7b0b7e7e296179f3",
  "stage_id": "M2-S1-FROZEN-SHARED-SEVEN-HEAD-CONTROL",
  "unified_repository": {
    "branch": "feat/m2-s1-runner",
    "commit": "0000000000000000000000000000000000000000",
    "remote_branch": "origin/feat/m2-s1-runner"
  },
  "canonical_config_sha256": "92436eff13c4c67a6dec8a3d645c4e40a4ce8c927d6cb522720709d980cff617",
  "model": {
    "model_id": "hfl/rbt3",
    "revision": "0aa0527ff4170f29e1dfd3eb6ef60dc67e1bf75c",
    "license": "Apache-2.0",
    "model_weight_sha256": "3e04f7477f55dffce2a2fbc4d0ba35068415162a9e92e3d5cc74a49781ba4eb0",
    "tokenizer_json_sha256": "53ff61207898738bbdc000f38abebef01041c8d23b6270c11855fc692d0a3ad6",
    "vocab_txt_sha256": "45bbac6b341c319adc98a532532882e91a9cefc0329aa57bac9ae761c27b291c"
  },
  "cache_snapshot_content_address": "33e1efd86cff8ed0d4039932fc25880fd89f9382347a0359e6c7a70648504b96",
  "runtime_environment_sha256": "13d11501fe5b43d97500909728ac1ed6e6118398b15c95ff9496f565e598c6c6",
  "cache_policy": {"local_files_only": true, "no_download": true},
  "execution": {
    "seeds": [35, 71, 107],
    "train_rows": 1822,
    "dev_rows": 448,
    "train_role": "TRAIN_ONLY_FIT",
    "dev_role": "EARLY_STOPPING_AND_DIAGNOSTIC_ONLY",
    "device_policy": "MPS_FIRST_CPU_FALLBACK",
    "per_run_wall_time_minutes": 120,
    "total_new_local_disk_gib": 10,
    "prohibitions": {
      "test": false, "anchor": false, "gold": false, "ood": false, "llm": false, "cloud_or_external_api": false, "production": false, "model_download": false, "dependency_install": false, "full_unfreeze": false, "s2_or_s3": false
    }
  },
  "output_dir": "/NO_OWNER_AUTHORIZATION_OUTPUT_DIR",
  "receipt_content_address": "064aca23e88b16105ffcaebaa8d0214935971906a34750e66a930a71723bc368"
}
